{
  "id": "kb-compliance-secrets-ci-001",
  "doc_type": "compliance_mapping",
  "title": "Secrets in CI/CD: NIST and FedRAMP alignment",
  "summary": "Maps plaintext-secret anti-patterns to NIST AC/IA families and FedRAMP access-control expectations.",
  "body": "Credentials embedded in repository YAML defeat rotation, auditing, and least privilege. NIST SP 800-53 Rev. 5 controls AC-2 (Account Management), AC-3 (Access Enforcement), IA-5 (Authenticator Management), and SC-12/SC-13 (Cryptographic Key Establishment and Protection) collectively expect secrets to be provisioned through approved mechanisms—not checked into VCS.\n\nFedRAMP baselines inherit these controls; Moderate environments typically require multifactor integration with enterprise IdP and vault-backed secrets for CI. Replace inline password: or token: literals with GitLab CI/CD variables (masked, protected) or a supported secrets manager.",
  "remediation": {
    "steps": [
      "Rotate any exposed credential; treat the repository as compromised until verified.",
      "Move values to masked CI variables or vault references; restrict branch/environment scope.",
      "Add server-side scanning (secret detection) in merge requests."
    ],
    "verification": "Grep for password:/token: patterns in .gitlab-ci.yml; confirm only variable references remain."
  },
  "compliance": {
    "nist": [
      {
        "control_id": "AC-2",
        "name": "Account Management",
        "discussion": "Accounts for non-person entities (CI jobs) should be provisioned and reviewed."
      },
      {
        "control_id": "IA-5",
        "name": "Authenticator Management",
        "discussion": "Authenticator distribution must not rely on cleartext storage in repos."
      },
      {
        "control_id": "SC-12",
        "name": "Cryptographic Key Establishment and Management",
        "discussion": "Keys and tokens require protected establishment paths."
      }
    ],
    "fedramp": [
      {
        "baseline": "High",
        "control": "AC-2 (Account Management) — automated non-human identities",
        "notes": "Document CI service accounts and vault integration in the SSP."
      },
      {
        "baseline": "Moderate",
        "control": "IA-5 (Authenticator Management)",
        "notes": "FedRAMP Moderate: align secret lifecycle with organizational key management policy."
      }
    ]
  },
  "related_rules": ["forbid_plaintext_password_in_gitlab_ci", "plaintext_secret_inline_secret_assignment"],
  "filters": {
    "finding_type": "ci_security",
    "platform": "gitlab_ci",
    "severity": "critical"
  }
}
